"Bachelor’s degree in a highly quantitative field (Computer Science, Machine Learning, Operational Research, Statistics, Mathematics, etc.) or equivalent professional or military experienceExperience with ML fields, e.g., natural language processing, computer vision, statistical learning theory10+ years of industry experience in predictive modeling, data science, and analysisExperience in an ML engineer or data scientist role building and deploying ML models or hands on experience developing deep learning modelsExperience writing code in Python, R, Scala, Java, C++ with documentation for reproducibilityExperience handling terabyte size datasets, diving into data to discover hidden patterns, using data visualization tools, writing SQL, and working with GPUs to develop modelsExperience writing and speaking about technical concepts to business, technical, and lay audiences and giving data-driven presentationsWant to help the largest global enterprises derive business value through the adoption of Artificial Intelligence (AI) and Machine Learning (ML)? Excited by using massive amounts of disparate data to develop ML models? Eager to learn to apply ML to a diverse array of enterprise use cases? Thrilled to be a part of Amazon who has been pioneering and shaping the world’s AI/ML technology for decades?At Amazon Web Services (AWS), we are helping large enterprises build ML models on the AWS Cloud. We are applying predictive technology to large volumes of data and against a wide spectrum of problems. AWS Professional Services works together with AWS customers to address their business needs using AI solutions.AWS Professional Services is a unique consulting team. We pride ourselves on being customer obsessed and highly focused on the AI enablement of our customers. If you have experience with AI, including building ML models, we’d like to have you join our team. You will get to work with an innovative company, with great teammates, and have a lot of fun helping our customers. A successful candidate will be a person who enjoys diving deep into data, doing analysis, discovering root causes, and designing long-term solutions.Inclusive Team CultureHere at AWS, we embrace our differences. We are committed to furthering our culture of inclusion. We have thirteen employee-led affinity groups, reaching 85,000 employees in over 190 chapters globally. We have innovative benefit offerings, and host annual and ongoing learning experiences, including our Conversations on Race and Ethnicity (CORE) and AmazeCon (gender diversity) conferences. Amazon’s culture of inclusion is reinforced within our 16 Leadership Principles, which remind team members to seek diverse perspectives, learn and be curious, and earn trust.Work/Life BalanceOur team puts a high value on work-life harmony. Striking a healthy balance between your personal and professional life is crucial to your happiness and success here. We are a customer-obsessed organization—leaders start with the customer and work backwards. They work vigorously to earn and keep customer trust. As such, this is a customer facing role in a hybrid delivery model. Project engagements include remote delivery methods and onsite engagement that will include travel to customer locations as needed.Mentorship & Career GrowthOur team is dedicated to supporting new members. We have a broad mix of experience levels and tenures, and we’re building an environment that celebrates knowledge sharing and mentorship. We care about your career growth and strive to assign projects based on what will help each team member develop into a better-rounded professional and enable them to take on more complex tasks in the future.This is a customer-facing role and you will be required to travel to client locations and deliver professional services as needed.Major responsibilities include:Assist customers by being able to deliver a ML project from beginning to end, including understanding the business need, aggregating data, exploring data, building & validating predictive models, and deploying completed models with concept-drift monitoring and retraining to deliver business impact to the organizationUse AWS AI services (e.g., Personalize), ML platforms (SageMaker), and frameworks (e.g., MXNet, TensorFlow, PyTorch, SparkML, scikit-learn) to help our customers build ML modelsResearch and implement novel ML approaches, including hardware optimizations on platforms such as AWS InferentiaWork with our other Professional Services consultants (Big Data, IoT, HPC) to analyze, extract, normalize, and label relevant data, and with our Professional Services engineers to operationalize customers’ models after they are prototypedMater’s degree of PhD in a highly quantitative field (Computer Science, Machine Learning, Operational Research, Statistics, Mathematics, etc.)Ability to develop strategic, baselined, data modeling processes; ability to accurately determine cause-and-effect relationships.Publications or presentations in recognized ML journals or conferencesDeep technical skills, consulting experience, and business savvy to interface with all levels and disciplines within our customers’ organizationDemonstrable track record of dealing well with ambiguity, prioritizing needs, and delivering results in a dynamic environmentFor employees based in Colorado, this position starts at $122,300 per year. A sign-on bonus and restricted stock units may be provided as part of the compensation package, in addition to a range of medical, financial, and/or other benefits, dependent on the position offered.Amazon is committed to a diverse and inclusive workplace. Amazon is an equal opportunity employer and does not discriminate on the basis of race, national origin, gender, gender identity, sexual orientation, protected veteran status, disability, age, or other legally protected status. For individuals with disabilities who would like to request an accommodation, please visit https://www.amazon.jobs/en/disability/us.",Data Scientist
"CFM, a sister-company to DBSI, is a progressive and innovative software company that is changing the way people interact with Banks and Credit Unions. CFM was recently added to Inc.'s 5000 list of fastest-growing companies, and Banking CEO identified CFM as a Top Banking Analytics Software provider.CFM's cause and ambition is big: to redefine an industry in need of a shakeup…banking. We are an unusually talented group dedicated to transforming financial institution spaces into unforgettable retail environments. We believe in hiring raw talent and cultivating champions. While the requirements and responsibilities listed below are extremely important to your success, we believe that your desire to learn, a positive attitude and your passion for success will be your greatest attributes.We are in search of a Software Developer to support our growing application demand. This position plays a key role in supporting the functional development of software solutions that connect banking equipment and systems. A Software Developer must be able to communicate confidently with technical personnel and work closely with other departments to deliver the highest level of solutions possible. The ideal candidate must be able to collect and assess functional requirements and support programming demands under tight deadlines – and have fun doing it.What we offer is an amazing culture, a competitive salary, profit sharing, generous medical insurance coverage, plus paid time off, 401k matching and the luxury of working in an award-winning environment, and a place where you can make a difference.Responsibilities and Deliverables:  This position needs to have a successful experience in delivering program solutions. Have the ability to:1) Maintain existing software product lines. Including functional enhancements, bug fixing, code optimization, etc.2) Team building. Cross-training team members and receiving training from team members on coding, business process related to software products, time management, etc.3) Customer support. Provide second line support for the front line technical support staff on customer issues4) New product designs, prototyping, and development5) Custom project development. Support sales and marketing on technical issues, design special project based on client needs, organize team members to deliver the project on-time and on budget.Skills/Qualifications: The ideal candidate should have:Understand ObjectOriented conceptsSoftware Design patternsBasic knowledge of database (relational/non-relational)Software development life CycleQuick learning experience with Web ServicesDemonstrate the ability to acquire new knowledge in a timely mannerGeneral ability and willingness to support and work with others within and outside of dept.Demonstrate resourcefulness, accountability and outstanding attention to detailAwesome person, go-getter personality, problem solver, with the ability to work well independentlyRequired skills:JavaPreferred Skills:· C/C++· .NET· MS SQL· Mongo DB· Cassandra DB· JBoss andApache Tomcat· RedisExperience: · 3+years’ experience with Software Development· 3+years' troubleshooting experience under tight deadlines· Able to manage multiple daily project requirementsJob Type: Full-timePay: $81,399.00 - $125,000.00 per yearBenefits:401(k)401(k) matchingDental insuranceFlexible scheduleFlexible spending accountHealth insuranceHealth savings accountLife insurancePaid time offReferral programVision insuranceSchedule:8 hour shiftMonday to FridayOvertimeCOVID-19 considerations:We've taken all necessary precautions to ensure our workspace meets and exceeds CDC standards.Experience:applied java: 1 year (Preferred)relevant: 1 year (Preferred)Education:Bachelor's (Preferred)Location:Tempe, AZ 85283 (Preferred)Work Location:One locationWork Remotely:No",Software Engineer
"Company DescriptionExperian is the world’s leading global information services company, unlocking the power of data to create more opportunities for consumers, businesses and society. We are thrilled to share that FORTUNE has named Experian one of the 100 Best Companies to work for. In addition, for the last five years we’ve been named in the 100 “World’s Most Innovative Companies” by Forbes Magazine.Job DescriptionWe are looking for highly motivated Level I Software Developer that can thrive in a fast-paced agile environment. You will be working closely with product owners, scrum masters, and other developers to create, enhance, and support our microservice.Primary Responsibilities Include:Interact with the team to define, refine, develop, test and deliver against functional requirementsUnderstand and translate functional into technical requirementsProvide input to the project delivery plan with regards to one’s areas of responsibilityCoordinate the work within the boundaries of their teams and projectBeing accountable for the quality of one’s team and supporting through code review processes and testing strategies as a whole-team approachImplement high-quality, performant, and reliable code on schedule and according to specificationDevelop and maintain test automation efficiency, coverage, and effectivenessUnderstand DevOps practices and processesResponsible for defect closure and root cause analysis to avoid regressionsWrite technical documentation for internal or external consumption, for developers of varying skills levelContribute to product release planningQualificationsQualifications & Skills Include:Candidate must possess at least a Bachelor's Degree in Computer Science/Information Technology, Engineering (Computer/Telecommunication) or similar discipline with strong development background.Strong programming, troubleshooting, analytical, & problem-solving skillsStrong communication, organizational, & interpersonal skillsUnderstand and familiar with:Java developmentWeb service developmentDatabase conceptsFamiliar with various tools & frameworks, including but not limited to Spring, Junit, Bitbucket, Jenkins, and CucumberUnderstand cloud technology – AWS, Kubernetes, and OpenshiftAdditional InformationAdditional Preferred ExperienceAn affinity to tech - curiosity and passionate about technology and how things work and the future of software engineeringGrit, adaptabilityA great attitude, energy, and enthusiasmSelf-starters with a desire to learn and apply their skills to something newAmbition to succeedAll your information will be kept confidential according to EEO guidelines.Experian is proud to be an Equal Opportunity and Affirmative Action employer. Our goal is to create a thriving, inclusive and diverse team where people love their work and love working together. We believe that diversity, equity and inclusion is essential to our purpose of creating a better tomorrow. We value the uniqueness of every individual and want you to bring your whole, authentic self to work. For us, this is The Power of YOU and it ensures that we live what we believe.",Software Engineer
"Businesses Raytheon Missiles & DefenseClearance type SecretRelocation eligible YesAbility to Telecommute No telecommutingJob ID 185618BRMost Recent Date Posted 08/12/2021City TucsonState AZCountry United StatesAbout Us:At Raytheon Missiles & Defense, fresh thinking and possibilities are forged in times of change and you will be on the front lines as we trail blaze new approaches, push the boundaries of innovation and chart a course to a tomorrow you can be proud to have a hand in creating.Job Summary:The Test Equipment and Environments Center (TE&EC) is within the Systems Integration & Test directorate at RMD. The Test Equipment and Environments Center (TE&EC) includes all of the engineering disciplines responsible for systems design & test on all Raytheon Missile Defense (RMD) products. Our engineers are responsible for all elements of the development lifecycle for test including: test requirements, test system design, flight simulations, hardware-in-the-loop, computer in-the-loop, advanced engineering prototyping technology, flight operations for manned and unmanned vehicles, environmental testing, environmental characterization and engineering laboratory management. We are hands-on, designing with the latest technology and tools, and integrate state of the art test solutions with the most advanced engineering systems in the world.TE&EC is seeking early career Software Engineer. You will participate on multidiscipline engineering teams contributing to the completion of all stages of test product development. You will be responsible for performing technical, cost and schedule management of their assigned projects. This position is focused on, but not limited to, the design, development, integration, test, and maintenance of software for TE&EC.Responsibilities to Anticipate:You will be a member of multidiscipline engineering teams performing design, development and integration of RMD test products within TE&EC.Typical work involves the development of both engineering and production test equipment, environments and systems.You will be expected to act, either as a part of the team or independently, to uncover and resolve issues associated with the development and implementation of test products.Qualifications You Must Have:Bachelor’s degree in Science, Technology, Engineering, or Mathematics (STEM).Experience with the development and integration of Product Test Equipment Hardware and SoftwareExperience developing and implementing high order programming languages (C#, C++, or C is preferred).The ability to obtain and maintain a US security clearance prior to the start date. U.S. citizenship is required as only U.S. citizens are eligible for a security clearance.Qualifications We Value:Experience with development and integration of software drivers for the operation of computer hardware interfaces.Able to perform sucessfully in an environment with frequent and direct interaction with customers and peersCurrent/Active DoD security clearance or SSBI.ABET is the preferred, although not required, accreditation standard.Demonstrated ability to work effectively with coworkers from diverse communities and cultures.Demonstrated ability to work with colleagues who represent a diversity of work and conflict resolution styles.What We Offer:Whether you are just starting out on your career journey, or are an experienced professional, we offer a robust total rewards package including compensation, healthcare, wellness, retirement, work/life benefits, career development and recognition programs. Some of the superior benefits we offer include parental (including paternal) leave, flexible work schedules, achievement awards, educational assistance and child/adult backup care.Additional Details:Please upload a copy of your most recent transcripts with your resume when applying to this requisition. Include your cumulative GPA and projected graduation date on your resume.Clearance Information: This position requires the eligibility to obtain a security clearance. Non-US citizens may not be eligible to obtain a security clearance. The Defense Industrial Security Clearance Office (DISCO), an agency of the Department of Defense, handles and adjudicates the security clearance process. More information about Security Clearances can be found on the US Department of State government website here: https://www.state.gov/m/ds/clearances/c10978.htmThis position is located in beautiful Tucson, AZ. Tucson has a friendly, caring and laid-back atmosphere, combined with the innovation and energy of a metropolitan region and recognized as one of America’s 10 Best Small Cities. Surrounded by beautiful mountains, colorful Sonoran Desert landscape and majestic saguaro cacti, Tucson is blessed with some of nature’s best work. Tucson is known for its bright blue skies, and with more than 310 sunny days per year, Tucson’s fantastic weather lets residents enjoy the outdoors year-round).Please upload a copy of your most recent transcripts with your resume when applying to this requisition. Include your cumulative GPA and projected graduation date on your resume.185618Raytheon Technologies is An Equal Opportunity/Affirmative Action Employer. All qualified applicants will receive consideration for employment without regard to race, color, religion, sex, sexual orientation, gender identity, national origin, disability or veteran status, age or any other federally protected class.",Software Engineer
"Grit Software Systems is a Microsoft Azure partner, focusing on identity and access management. We help large and medium sized enterprises migrate to Azure identity platform.As an employee of Grit, you will get an opportunity to learn about Azure Stack, distributed computing and running large scale services for well known, brand name enterprise customers in depth. The work we do is fun and challenging.It is preferable that the candidates have experience in C# and UX technologies like angular or react. Even if you don't have those technology skills, we are mostly looking for passionate, smart, hard workers willing to learn and grow with a background in programming. We are looking for people at all seniority levels - from beginner to architects.In addition to challenging work and great colleagues, we offer competitive pay packages and benefits.Job Type: Full-timePay: $75,000.00 - $150,000.00 per yearBenefits:401(k)401(k) matchingHealth insurancePaid time offParental leaveReferral programSchedule:8 hour shiftMonday to FridaySupplemental Pay:Signing bonusCOVID-19 considerations:Grit Software Systems gives employees the choice to work from home or in office based on their situation.Work Location:Multiple locationsWork Remotely:Yes",Software Engineer
"About GMThere's never been a more exciting time to work for General Motors.To achieve our vision of a world with Zero Crashes, Zero Emissions and Zero Congestion, we need people to join us who are passionate about creating safer, better and more sustainable ways for people to get around. This bold vision won't happen overnight, but just as we transformed how the world moved in the last century, we are committed to transforming how we move today and in the future.Why Work for UsOur culture is focused on building inclusive teams, where differences and unique perspectives are embraced so you can contribute to your fullest potential as you pursue your career. Our locations feature a variety of work environments, including open work spaces and virtual connection platforms to inspire productivity and flexible collaboration. And we are proud to support our employees volunteer interests, and make it a priority to join together in efforts that give back to our communities.Job DescriptionAbout the GM Global Manufacturing IT team:GM's Manufacturing IT team innovates and drives business value with systems that help GM deliver consistent messaging, transactions and services. The Manufacturing IT team is responsible for developing and delivering solutions leveraging a wide array of systems architectures and technical platforms. Our industry leading developers, engineers, testers and architects work closely with internal teams and dealers to deliver the world's best customer experience. In short, we're currently seeking the next generation of game-changers to help us usher in a new age of automotive IT innovation. Are you ready to rise to the challenge?About you:You have demonstrated success in software project delivery experience in leading technical efforts developing applications using a variety of tools, languages, frameworks and technologiesDemonstrate mastery of many programming languages, tools and/or technologiesPerformance tuning, usability assessment/improvementStrong Knowledge of maintaining and debugging live software systems.You engage in the remediation of software issues related to code/solutions quality and/or securityPossess technical writing knowledge around system design specification and user documentation of software systems and ensure that technical documentation meets GM standardsUnderstand and maintain compliance with GM standards and industry standard methodologyHolds themselves and others accountable for demonstrating GMs values and cultural behaviors. Models GM behaviors and builds a winning culture.Additional Job DescriptionMinimum Qualifications:Minimum 5 years of professional software development experienceExcellent technical knowledge of Java, .NET and Object Oriented best practicesJava and .NET platform developmentExperience with Oracle data developement (analysis and working inside Oracle environment)Preferred qualifications:Experience with full stack developmentBenefits OverviewThe goal of the General Motors total rewards program is to support the health and well-being of you and your family. Our comprehensive compensation plan incudes, the following benefits, in addition to many others:Paid time off including vacation days, holidays, and parental leave for mothers, fathers and adoptive parents;Healthcare (including a triple tax advantaged health savings account and wellness incentive), dental, vision and life insurance plans to cover you and your family;Company and matching contributions to 401K savings plan to help you save for retirement;Global recognition program for peers and leaders to recognize and be recognized for results and behaviors that reflect our company values;Tuition assistance and student loan refinancing;Discount on GM vehicles for you, your family and friends.Diversity InformationGeneral Motors is committed to being a workplace that is not only free of discrimination, but one that genuinely fosters inclusion and belonging. We strongly believe that workforce diversity creates an environment in which our employees can thrive and develop better products for our customers. We understand and embrace the variety through which people gain experiences whether through professional, personal, educational, or volunteer opportunities.GM is proud to be an equal opportunity employer.We encourage interested candidates to review the key responsibilities and qualifications and apply for any positions that match your skills and capabilities.Equal Employment Opportunity StatementsThe policy of General Motors is to extend opportunities to qualified applicants and employees on an equal basis regardless of an individual's age, race, color, sex, religion, national origin, disability, sexual orientation, gender identity/expression or veteran status. Additionally, General Motors is committed to being an Equal Employment Opportunity (EEO) Employer and offers opportunities to all job seekers including individuals with disabilities. If you need a reasonable accommodation to assist with your job search or application for employment, email us atCareers.Accommodations@GM.com. In your email, please include a description of the specific accommodation you are requesting as well as the job title and requisition number of the position for which you are applying.",Software Engineer
